{
  "contract_version": "2.0.0",
  "object_type": "anomaly",
  "object_id": "anomaly:tenant_a:user-42:2026-09-26:failed-login-burst",
  "revision": 2,
  "operation": "upsert",
  "generation": "auth-detection-2.1.0",
  "organization_id": "tenant_a",
  "namespace": "tenant_a",
  "rule_id": "failed-login-burst",
  "rule_version": "2.1.0",
  "run_id": "run-20260927-001",
  "window_start": "2026-09-26T10:00:00Z",
  "date_key": "2026-09-26",
  "input_refs": [
    {"object_type": "feature", "object_id": "feature:tenant_a:user-42:2026-09-26:auth-failures", "revision": 4, "content_hash": "aaaaaaaaaaaaaaaaaaaaaaaaaaaaaaaaaaaaaaaaaaaaaaaaaaaaaaaaaaaaaaaa"}
  ],
  "document": {"organization": {"id": "tenant_a"}, "status": "active"}
}
